{
  "$schema": "https://json-schema.org/draft/2020-12/schema",
  "title": "Solver Input Schema",
  "description": "Deterministic configuration for Navier-Stokes solver. No internal defaults permitted.",
  "type": "object",
  "required": [
    "grid",
    "fluid_properties",
    "simulation_parameters",
    "boundary_conditions",
    "mask",
    "external_forces",
    "physical_constraints"
  ],
  "properties": {
    "physical_constraints": {
      "type": "object",
      "required": [
        "min_velocity",
        "max_velocity",
        "min_pressure",
        "max_pressure"
      ],
      "properties": {
        "min_velocity": {
          "type": "number",
          "description": "Lower bound for any velocity component (u, v, w). Often 0 or negative for turbulence."
        },
        "max_velocity": {
          "type": "number",
          "description": "Upper bound for any velocity component. Triggers recovery if exceeded."
        },
        "min_pressure": {
          "type": "number",
          "description": "Lower bound for pressure. Prevents non-physical vacuum/sink divergence."
        },
        "max_pressure": {
          "type": "number",
          "description": "Upper bound for pressure. Prevents numerical explosions."
        }
      }
    },
    "grid": {
      "type": "object",
      "required": [
        "x_min",
        "x_max",
        "y_min",
        "y_max",
        "z_min",
        "z_max",
        "nx",
        "ny",
        "nz"
      ],
      "properties": {
        "x_min": {
          "type": "number",
          "description": "Physical coordinate of the domain start in X."
        },
        "x_max": {
          "type": "number",
          "description": "Physical coordinate of the domain end in X."
        },
        "y_min": {
          "type": "number",
          "description": "Physical coordinate of the domain start in Y."
        },
        "y_max": {
          "type": "number",
          "description": "Physical coordinate of the domain end in Y."
        },
        "z_min": {
          "type": "number",
          "description": "Physical coordinate of the domain start in Z."
        },
        "z_max": {
          "type": "number",
          "description": "Physical coordinate of the domain end in Z."
        },
        "nx": {
          "type": "integer",
          "minimum": 4,
          "description": "Number of discrete computational cells along the X-axis. Minimum 4 to prevent stencil cancellation."
        },
        "ny": {
          "type": "integer",
          "minimum": 4,
          "description": "Number of discrete computational cells along the Y-axis. Minimum 4 to prevent stencil cancellation."
        },
        "nz": {
          "type": "integer",
          "minimum": 4,
          "description": "Number of discrete computational cells along the Z-axis. Minimum 4 to prevent stencil cancellation."
        }
      }
    },
    "fluid_properties": {
      "type": "object",
      "required": [
        "density",
        "viscosity"
      ],
      "properties": {
        "density": {
          "type": "number",
          "exclusiveMinimum": 0
        },
        "viscosity": {
          "type": "number",
          "minimum": 0
        }
      }
    },
    "simulation_parameters": {
      "type": "object",
      "required": [
        "time_step",
        "total_time",
        "output_interval"
      ],
      "properties": {
        "time_step": {
          "type": "number",
          "exclusiveMinimum": 0
        },
        "total_time": {
          "type": "number",
          "exclusiveMinimum": 0
        },
        "output_interval": {
          "type": "integer",
          "minimum": 1
        }
      }
    },
    "boundary_conditions": {
      "type": "array",
      "items": {
        "type": "object",
        "required": [
          "location",
          "type",
          "values"
        ],
        "properties": {
          "location": {
            "enum": [
              "x_min",
              "x_max",
              "y_min",
              "y_max",
              "z_min",
              "z_max",
              "wall"
            ]
          },
          "type": {
            "enum": [
              "no-slip",
              "free-slip",
              "inflow",
              "outflow",
              "pressure"
            ]
          },
          "values": {
            "type": "object",
            "properties": {
              "u": {
                "type": "number"
              },
              "v": {
                "type": "number"
              },
              "w": {
                "type": "number"
              },
              "p": {
                "type": "number"
              }
            },
            "additionalProperties": false,
            "minProperties": 1
          }
        }
      }
    },
    "mask": {
      "type": "array",
      "description": "Canonical flattening: i + nx*(j + ny*k). Must match grid.nx*grid.ny*grid.nz length.",
      "items": {
        "type": "integer",
        "enum": [
          -1,
          0,
          1
        ]
      }
    },
    "external_forces": {
      "type": "object",
      "required": [
        "force_vector"
      ],
      "properties": {
        "force_vector": {
          "type": "array",
          "description": "Generic external force density vector (e.g., electromagnetic, momentum sources).",
          "minItems": 3,
          "maxItems": 3,
          "items": {
            "type": "number"
          }
        }
      }
    }
  }
}