{
    "grid": {
        "x_min": 0.0,
        "x_max": 4.0,
        "y_min": 0.0,
        "y_max": 4.0,
        "z_min": 0.0,
        "z_max": 2.0,
        "nx": 8,
        "ny": 8,
        "nz": 4
    },
    "fluid_properties": {
        "density": 1.0,
        "viscosity": 0.01
    },
    "simulation_parameters": {
        "time_step": 0.1,
        "total_time": 1.0,
        "output_interval": 5
    },
    "boundary_conditions": [
        {
            "location": "z_min",
            "type": "inflow",
            "values": {
                "u": 0.0,
                "v": 0.0,
                "w": 1.0,
                "p": 0.0
            }
        },
        {
            "location": "z_max",
            "type": "outflow",
            "values": {
                "u": 0.0,
                "v": 0.0,
                "w": 1.0,
                "p": 0.0
            }
        },
        {
            "location": "wall",
            "type": "no-slip",
            "values": {
                "u": 0.0,
                "v": 0.0,
                "w": 0.0,
                "p": 0.0
            }
        }
    ],
    "mask": [
        0,  0,  0,  0,  0,  0,  0,  0,
        0, -1, -1, -1, -1, -1, -1,  0,
        0, -1,  1,  1,  1,  1, -1,  0,
        0, -1,  1,  1,  1,  1, -1,  0,
        0, -1,  1,  1,  1,  1, -1,  0,
        0, -1,  1,  1,  1,  1, -1,  0,
        0, -1, -1, -1, -1, -1, -1,  0,
        0,  0,  0,  0,  0,  0,  0,  0,
        
        0,  0,  0,  0,  0,  0,  0,  0,
        0, -1, -1, -1, -1, -1, -1,  0,
        0, -1,  1,  1,  1,  1, -1,  0,
        0, -1,  1,  1,  1,  1, -1,  0,
        0, -1,  1,  1,  1,  1, -1,  0,
        0, -1,  1,  1,  1,  1, -1,  0,
        0, -1, -1, -1, -1, -1, -1,  0,
        0,  0,  0,  0,  0,  0,  0,  0,
        
        0,  0,  0,  0,  0,  0,  0,  0,
        0, -1, -1, -1, -1, -1, -1,  0,
        0, -1,  1,  1,  1,  1, -1,  0,
        0, -1,  1,  1,  1,  1, -1,  0,
        0, -1,  1,  1,  1,  1, -1,  0,
        0, -1,  1,  1,  1,  1, -1,  0,
        0, -1, -1, -1, -1, -1, -1,  0,
        0,  0,  0,  0,  0,  0,  0,  0,
        
        0,  0,  0,  0,  0,  0,  0,  0,
        0, -1, -1, -1, -1, -1, -1,  0,
        0, -1,  1,  1,  1,  1, -1,  0,
        0, -1,  1,  1,  1,  1, -1,  0,
        0, -1,  1,  1,  1,  1, -1,  0,
        0, -1,  1,  1,  1,  1, -1,  0,
        0, -1, -1, -1, -1, -1, -1,  0,
        0,  0,  0,  0,  0,  0,  0,  0
    ],
    "external_forces": {
        "force_vector": [
            0.0,
            0.0,
            0.0
        ]
    },
    "physical_constraints": {
        "min_velocity": -100.0,
        "max_velocity": 100.0,
        "min_pressure": -1000.0,
        "max_pressure": 1000.0
    }
}